Name,Assign,Status
Design Main Character and Backstory,,Done
Decide character motivations for transferring to SSU,,Done
Decide what makes main character special from other characters,,Done
"Flesh out lore characters - (Cult leader, his brother, and any other potential characters)",,Done
Flesh out setting - (Campus Map),,In progress
Create Hypothetical Scenarios - (Test bounds of our story constraints),,Not started
Create Characters based on Hypotheticals and Setting,,Not started
Write Gameplay Story Overview,,Not started
Keep Discussing Hypotheticals,,Not started